Business,Phase,Resource_Type,Resource_Category,Amount,Unit,Timeline,Status,Notes
grower,design,capital,initial_investment,125000,USD,Month 1,Required,Land acquisition and setup
grower,design,capital,working_capital,25000,USD,Months 1-6,Required,Operating expenses buffer
grower,design,human,full_time_equivalent,2.5,FTE,Months 1-18,Required,Farm manager + 1.5 workers
grower,design,human,specialist_consulting,40,Hours,Months 1-3,Required,Agricultural and regulatory expertise
grower,design,equipment,processing_equipment,35000,USD,Month 3,Required,Drying and initial processing
grower,design,equipment,farm_equipment,15000,USD,Month 2,Required,Cultivation tools and irrigation
grower,design,land,cultivation_area,5,Acres,Month 1,Required,Suitable papaya growing land
grower,design,regulatory,certifications,8000,USD,Months 6-12,Required,Organic and quality certifications
